{
  "schema_version": 1,
  "kind": "openclaw-agent-package",
  "id": "review-agent",
  "display_name": "Review Agent",
  "description": "独立代码、测试与安全审查。",
  "origin": "builtin",
  "protected": true,
  "deletable": false,
  "workspace_source_rel": "agents/review-agent/workspace",
  "runtime_subdir": "agents/review-agent",
  "role": "worker",
  "capabilities": ["code.review", "test.review", "security.review"],
  "model": "deepseek/deepseek-v4-pro",
  "delegation": { "callable_by_manager": true, "allow_agents": [] },
  "sandbox_mode": null,
  "assembly": { "include_common_rules": true, "include_templates": false },
  "skills": [],
  "lifecycle": { "register": true, "active": true }
}
