{
  "schema_version": 1,
  "kind": "openclaw-agent-package",
  "id": "requirement-agent",
  "display_name": "Requirement Agent",
  "description": "需求分析、验收标准与追踪关系。",
  "origin": "builtin",
  "protected": true,
  "deletable": false,
  "workspace_source_rel": "agents/requirement-agent/workspace",
  "runtime_subdir": "agents/requirement-agent",
  "role": "worker",
  "capabilities": ["requirements.analysis", "acceptance.criteria"],
  "model": "deepseek/deepseek-v4-flash",
  "delegation": { "callable_by_manager": true, "allow_agents": [] },
  "sandbox_mode": null,
  "assembly": { "include_common_rules": true, "include_templates": false },
  "skills": [],
  "lifecycle": { "register": true, "active": true }
}
