{
  "schema_version": 1,
  "kind": "openclaw-agent-package",
  "id": "manager-agent",
  "display_name": "Manager Agent",
  "description": "唯一用户入口与工作流总控。",
  "origin": "builtin",
  "protected": true,
  "deletable": false,
  "workspace_source_rel": "agents/manager-agent/workspace",
  "runtime_subdir": "agents/manager-agent",
  "role": "manager",
  "capabilities": ["workflow.orchestration", "agent.lifecycle", "skill.lifecycle"],
  "model": "deepseek/deepseek-v4-pro",
  "delegation": { "callable_by_manager": false, "allow_agents": [], "require_agent_id": true, "delegation_mode": "prefer" },
  "sandbox_mode": null,
  "assembly": { "include_common_rules": true, "include_templates": true },
  "skills": ["skill-creator", "agent-package-manager"],
  "lifecycle": { "register": true, "active": true }
}
